{
  "schema": "sweep.v1",
  "sweep_id": "20260925T1230Z",
  "started_at": "2026-09-25T12:30:04Z",
  "finished_at": "2026-09-25T12:33:45Z",
  "source": "tfl-jamcam",
  "cameras_listed": 6,
  "frames_ok": 4,
  "frames_failed": {
    "timeout": 1,
    "http": 1,
    "decode": 0,
    "network": 0,
    "detect": 0
  },
  "persons_total": 6,
  "umbrellas_total": 2,
  "per_camera": {
    "JamCams_00001.01251": {
      "persons": 4,
      "umbrellas": 1
    },
    "JamCams_00001.01254": {
      "persons": 2,
      "umbrellas": 0
    },
    "JamCams_00001.01256": {
      "persons": 0,
      "umbrellas": 1
    }
  },
  "weather": {
    "temp_c": 16.8,
    "apparent_c": 15.9,
    "precip_mm": 0.2,
    "observed_at": "2026-09-25T12:00:00Z",
    "source": "metoffice"
  },
  "engine_version": "0.0.0",
  "model": "yolox_m",
  "model_sha256": "21ff6cfdeb53b013bac2249599e55f00bff3cfdfdab37ed7a4620818c1d15b3f",
  "attribution": [
    "Powered by TfL Open Data",
    "Powered by Met Office data"
  ]
}
